{
  "schema": "atelier-authoring-projection@v1",
  "projectionId": "sample:projection:review",
  "tenantRef": "sample-studio",
  "extensionPack": {
    "id": "sample.authoring",
    "version": "v1"
  },
  "surface": {
    "surfaceRef": "sample:surface:workbench",
    "title": "Sample review workbench",
    "sourceRefs": [
      "sample:manifest:editorial",
      "sample:artifact:review-desk"
    ]
  },
  "capabilities": [
    "review.read",
    "review.annotate",
    "review.record-note",
    "review.export"
  ],
  "authority": {
    "projectionOnly": true,
    "localAuthoringState": "consumer-owned",
    "publicationMutation": false,
    "editorialGateMutation": false,
    "runtimeMutation": false
  }
}
